<?xml version="1.0" encoding="UTF-8"?>
<library xmlns:xsi="http://www.w3.org/2001/XMLSchema-instance" xsi:noNamespaceSchemaLocation="library.xsd">
<book>
    <name>Kytice</name>
    <year>1853</year>
    <isbn>ISBN 8-77-88-22-3</isbn>
    <category>poezie</category>
</book>
<book>
    <name>LOTR</name>
    <year>1954</year>
    <isbn>ISBN 2332-2778-726652-99-0</isbn>
    <category>sci-fi</category>
</book>
</library>